fecha,modulo,detalle,comentario,solucion,fecha_id,modulo_id,detalle_id,comentario_id,solucion_id
15/03/2023,constancia vacaciones,descargar constancia muestra datos incorrectos,reivso consulta datos detecto error validacion ingreso apra tomar dias corresponde ejercicio,ajusto consulta mostrar dato correcto,55,89,234,207,157
15/03/2023,empleados,realizar proceso cambio puesto no actualizo dato numero hik,movimientos empleados correspondian ajuste sistema,hicieron movimientos manuales hik registre movimientos numero empleado correcto,55,25,235,208,158
16/03/2023,checadas,solicitud descarga checadas biometrico bromo,registros deben ser descargados attendance conexion no permite descarga sistema,vacio,56,31,124,47,92
16/03/2023,finiquitos,solicitud cancelar finiquitos poder generar nuevamente pago correcciones,vacio,eliminaron datos acumulado,56,30,236,92,159
16/03/2023,empleados,consulta movimiento empleado cambio nomina,"realizar descarga archivo dispersion no aparece empleado cambio nomina , ?afectara acumulacion reportes si queda movimiento ?",empleado debe regresar nomina va pagar periodo yuna vez acumula entonces hacer cambio,56,25,237,209,160
16/03/2023,reporte comparativo,realizar descarga reporte comparativo nomina actual anterior no aparece informacion,reviso detalle origina periodo nomina 10 acumulo sin datos calculados,debe `` replicar '' calculo archivo respaldo subir historicos,56,126,238,210,161
17/03/2023,recibos portal,consultar recibos pago portal colaboradores aparece inconcistencias,portal local aparece dato erroneo sueldo logotipos sika,realizo actualizacion proyecto procedimiento consulta,57,127,239,211,162
17/03/2023,finiquitos,"realizo acumulacion erronea finiquito , solicitud solo eliminar concepto duplicado",vacio,elimino manualmente concepto pago finiquito,57,30,240,92,163
17/03/2023,cancelacion xml,realizar cancelacion ventana advertencia no muestra dato,reviso tablas movimiento genero correctamente,vacio,57,122,241,212,92
17/03/2023,finiquitos,intentar excluir credito tabla no muestre reporte marca error,vacio,descargar reporte primero debe desmarcar prestamo despues consultar reporte no aparezca advertencia,57,30,242,92,164
21/03/2023,constancias,tratar imprimir constancia marca error no permite visualizacion,"reviso proceso consulta datos , pasar procedimeinto faltaba funcion utilizada mismo",agrego funcion mostraran datos forma correcta,58,128,243,213,165
21/03/2023,acceso sistema,"problemas acceder sistema , queda cargando",vacio,reinicio servicio iis,58,73,244,92,75
21/03/2023,acceso sistema,"problemas acceder sistema , queda cargando",vacio,reinicio servicio iis,58,73,244,92,75
21/03/2023,timbrado,revision dudas proceso validador version 4.0 timbrado nomina,reviso configuracion error indica tipo regimen no coincide,"valido configuracion empleado correcta , realiza ajuste codigo valores fijos",58,18,245,214,166
21/03/2023,timbrado finiquito,detecto inconsistencia empleado sistema timbrado pero no aparece sat,"valido proceso empleado correcto , xml no aparece reflejado , determina timbro ambiente prueba invalido sat",debe timbrar nueva cuenta validar correcto cancelar sistema anterior,58,129,246,215,167
21/03/2023,acumulacion,"realizar proceso acumulacion equipo `` bloqueo '' , solicitud revisar proces","reviso status nomina , acumulo correctamente quedo historico","proceso inicializar campos no ejecuto , realizo manualmente",58,83,247,216,168
22/03/2023,prima vacacional,solicitud configurar pago prima vacacional periodo abierto,realizo configuracion item tomar dias indicados,envio listado plazas dias pagar validacion,59,130,248,217,169
22/03/2023,timbrado 4.0,realizar proceso timbrado nomina anterior aparece error indica nombre incorrecto,`` orden '' nombre no actualizado,realizo cambio procedimiento muestre dato correcto,59,131,249,218,170
22/03/2023,timbrado 4.0,solicitud activar proceso timbrado nueva version,vacio,realizo ajuste configuracion aplicar cambio,59,131,250,92,171
23/03/2023,checadas,solicitud descarga checadas biometrico bromo,registros deben ser descargados attendance conexion no permite descarga sistema,vacio,60,31,124,47,92
23/03/2023,finiquitos,solicitud cancelar finiquitos poder generar nuevamente pago correcciones,proceso debe realizar manual no opcion habilitada sistema,realizo `` reactivacion '' empleados dentro modulo finiquitos,60,30,236,219,172
23/03/2023,acceso sistema,"no permite ingresar sistema , queda cargando",vacio,reinicio servicio iis,60,73,251,92,75
23/03/2023,constancias,intentar realizar consulta formato aparece error pantalla reporte,realizar consulta tarda visualizar informacion formato contiene solo imagenes,reiniciar iis mostro sin problemas,60,128,252,220,173
23/03/2023,tiempo extra,intentar realizar carga tiempo extra aparece ventana advertencia debe berificar informacion formato,archivo intenta subir viene formato formulado,realizo copia informacion sin formato archivo nuevo pueda cargar,60,33,253,221,174
23/03/2023,vacaciones,realizar captura dias vacaciones importe pagar aparece incorrecto,"reviso configuracion calculo sistema , aparece correcto , usuario no consideraba parte proporcional septimo dia concepto vacaciones , incluirlo valor calculado manual coincide sistema",vacio,60,7,254,222,92
23/03/2023,vacaciones,empleados captura dias vacaciones no refleja pago,"reviso informacion dato si aparece correctamente , solicito numero empleado validar",usuario informo confusion datos si aparecen correctos,60,7,255,223,175
23/03/2023,reporte comparativo,consulta realizar descarga comparativo dos nominas acumuladas,usuario requiere realizar descarga,indico menu puede realizar descarga dicho reporte menu reportes - reportes nominas anteriores - comparativo caratula,60,126,256,224,176
23/03/2023,datos generales,realizar actualizacion datos generales aparece ventana advertencia,"advertencia mostrada datos contacto , seccion no aceptan acentos ni n",realizo captura modificando letra n n permita almacenar,60,132,257,225,177
23/03/2023,contratos,solicitud ajuste contratos,"solicitud cambios correo , ajuste clausulas",vacio,60,21,258,226,92
23/03/2023,dispersion pago,intentar realizar descarga formato dispersion aparece ventana error,"realizo proceso todas razones sociales no mostro ningun error , pregunto usuario datos seleccion",vacio,60,133,259,227,92
24/03/2023,vacaciones,solicitud agregar reporte visualizacion saldo vacaciones,vacio,agrego formato diseno reportes,61,7,260,92,178
24/03/2023,acceso sistema,"no permite ingresar sistema , queda cargando",despues tiempo pudo ingresar sin problemas,vacio,61,73,251,228,92
25/03/2023,empleados,solicitud ajuste dato codigo portal empleado baja,sistema no permite realizar ajuste datos generales colaborador baja,realizo ajuste manual datos,62,25,261,229,179
27/03/2023,usuarios portal,consulta saber si posible realice cambio contrasena portal usuarios,solo puede ser actualizado red local sika solo datos consulta,realizo indicacion proceso debe seguir realizar cambios,63,134,262,230,180
27/03/2023,validador cfdi 4.0,consulta error regresado validador,vacio,reenvio correo especificacion errores,63,135,263,92,181
27/03/2023,empleados,ingresar ventana movimientos activos aparece ventana error,error originado empresa dada alta variable mismo nombre item global sistema nueva version actualizada,realizo cambio nombre variable sistema obtenia mismo datos item,63,25,264,231,182
27/03/2023,finiquitos,querer realizar consulta finiquito aparece ventana error,error originado empresa dada alta variable mismo nombre item global sistema nueva version actualizada,realizo cambio nombre variable sistema obtenia mismo datos item,63,30,265,231,182
27/03/2023,validador cfdi 4.0,consulta proceso validacion cfdi sistema apra version 4.0,vacio,indico proceso opcional funcionalidad mismo,63,135,266,92,183
27/03/2023,finiquitos,realizar consulta empleado prestamo aparece ventana error querer desmarcar descuento,"detalle originado codigo , debe pasar desarrollo validacion",indico proceso debe seguir `` saltar '' ventana error poder exportar documento correctamente,63,30,267,232,184
27/03/2023,asignacion plazas,realizar asignacion plazas sistema muestra advertencia periodo asignacion,"plazas no pueden asignar mas colaborador periodo `` igual '' cubra ciertos dias , deben ser asignados periodos no `` empalmen ''",mando informacion movimiento asignacion `` empalmaba '' datos,63,136,268,233,185
28/03/2023,dia festivo,consulta validar campo complementario sube valor horas pago concepto dia festivo,vacio,indico proceso seguir,64,137,269,92,105
28/03/2023,nomina especial,"detalle realizar nomina especial empleado dado baja , no aparece inforamcion nomina",revisar informacion detalle origino hacer carga informacion empleado distinto calculando,hacer ajuste datos empleado correcto,64,62,270,234,186
28/03/2023,configuracion,solicitud ajuste configuraciones require agregar 4 turnos mas sistema,"ajustes afectan modulo calculo dias , debe considerar informacion comedor completar datos",realizaron ajustes solicitados configuracion turnos,64,14,271,235,187
28/03/2023,validador cfdi 4.0,detalles validacion datos empresa valmur desarrollo,dentro sistema version publicada no valida forma correcta datos tipo contrato tipo regimen,genero proceso version desarrollo bd enviar informacion completa,64,135,272,236,188
28/03/2023,finiquitos,consulta proceso seguir captura descuento pension alimenticia liquidacion,si concepto no existe debe ser agregado captura importe descuento,vacio,64,30,273,237,92
29/03/2023,finiquitos,querer realizar proceso efectuar baja aparece ventana error,reviso proceso completo bd respaldo aplico forma correcta,indico intentara realizar proceos comprobar problema conexion datos,65,30,274,238,189
29/03/2023,reporte vacaciones,realizar revision datos detectaron empleados informacion erronea,empleados detalle traen periodo vacaciones iniciado ejercicio 2022 terminando 2023,agrego ajuste proceso no incluir periodos no corresponden reporte ventana vacaciones,65,138,275,239,190
29/03/2023,despensa,revision tope despensa,tope correcto debe configurado uma dias 3.4 redondeo debe ser hacia abajo,realizo ajuste formulas,65,139,276,240,191
29/03/2023,finiquitos,solicitud dar alta concepto pension alimenticia modulo finiquitos,vacio,agrego concepto solicitado nominas,65,30,277,92,192
29/03/2023,reportes,intentar descargar reporte comparativo sistema aparece ventana error,error originado tabla datos llena grids lleva mismo nombre formulario no estan limpiando datos ingresar nuevo formulario,indico usuario cerrara sesion iniciara nueva cuenta restablecieran variables,65,32,278,241,193
29/03/2023,configuracion,revision configuracion concepto sueldo dia festivo laborado,"comento conceptos no mostraban informacion correcta , infico configuracion determino sistema mostraba datos segun configurado",indicaron ajustes realizar ajustaron formulas,65,8,279,242,194
29/03/2023,reportes,consulta saber si existe reporte consulta listado hijos colaboradores,"indico existencia reporte , usuario no tenia permisos visualizacion",indico usuario dar permisos poder visualizar reporte,65,32,280,243,195
29/03/2023,timbrado 4.0,"realizar timbrado empresa valmur desarrollo , consulto cfdi pero arroja no existe","reviso informacion correcta sat , determino detalle presenta servicio consulta utilizado sistema",paso solicitud revision desarrollo,65,131,281,244,196
30/03/2023,checadas,solicitud descarga checadas ambos biometricos,registros deben ser descargados attendance conexion no permite descarga sistema,vacio,66,31,282,47,92
30/03/2023,timbrado nomina,intentar timbrar registros incapacidad aparece adverntencia indica no encuentra nodo,revisar proceso generar xml aparecen datos pero codigo no genera nodo,realizaron ajustes desarrollo muestre dato completo,66,69,283,245,197
30/03/2023,timbrado finiquitos,intentar timbrar finiquito aparece ventana error,detalle originado campo requerido proceso timbrado no apareciendo consulta datos,agrego dato faltantes poder avanzar proceso hizo ajuste codigo variable no declarada,66,2,284,246,198
30/03/2023,contratos,"realizar impresion contrato aparece clausila quinca decima , `` salta '' datos pagina","reviso formato si cargada informacion , `` ajusto '' tamano caja texto tomar espacio hoja",vacio,66,21,285,247,92
30/03/2023,horas extras,realizar carga tiempo extra no ve reflejado pago,almacena movimiento horas pero no actualiza valor campo complementario .,vacio,66,140,286,248,92
30/03/2023,empleados,intentar realizar modificacion datos empleado aparece ventana error,error originado dato obligatorio captura viene sin valor,indico usuario debia seleccionar dato campo poder avanzar modificacion,66,25,287,249,199
31/03/2023,timbrado 4.0,solicitud activar proceso timbrado version 4.0,cambio configuracion publicacion,vacio,67,131,288,250,92
31/03/2023,reingreso,intentar realizar reingreso colaborador aparece ventana advertencia,reviso detalle detecto origen procesimiento almancenado,pasaron ajustes cliente intentar realizar reingreso,67,141,289,251,200
31/03/2023,acumulacion,realizar proceso acumulacioon quedo `` congelado '',revisar servidor no `` trabajando '' determino cancelo proceso pr comunicacion,debe cerrar acceso completo iniciar nuevo ejecutarlo nuevamente,67,83,290,252,201
31/03/2023,poliza contable,realizar nomina especial intentar generar archivo poliza no aparece registro,no muestra empleado baja no contaba dato centro costo asignado,asigno dato forma interna poder descargar poliza,67,4,291,253,202
31/03/2023,acumulacion,realizar proceso acumulacioon quedo `` congelado '',revisar servidor no `` trabajando '' determino cancelo proceso pr comunicacion,debe cerrar acceso completo iniciar nuevo ejecutarlo nuevamente,67,83,290,252,201
31/03/2023,calculo,realizar calculo nomina no aparece importe compensacion colaborador,"detecto colaborador dio alta `` doble '' distinto numero , habia asignado compensacion registro erroneo",solicito eliminar registro empleado erroneo no tener informacion erronea,67,80,292,254,203
31/03/2023,configuracion,solicitud ajuste configuracion pago bono,colaborador falta injustificada no realizar pago delconcepto,creo item requerimientos ajustola configuracion base concepto,67,8,293,255,204
31/03/2023,portal colaboradores externo,ingresar aparece pantalla error,reviso detalle portal local externo pero no detecto detalle,"revisar usuario detalle aparecia forma abre pantalla , intenta abrir directo ventana consulta debe ingresar link principal .",67,142,294,256,205
31/03/2023,datos acumulados,realizar revision datos acumulados aparecen totales erroneos,reviso informacion error debio proceso acumulacion `` doble '' error proceso acumulacion,elimino periodo acumulado forma erronea solo quedara informacion completa pago,67,143,295,257,206
2023-01-04 00:00:00,poliza contable,intentar exportar datos poliza contable no aparecen finiquitos reportes acumulados si muestra,finiquitos no almacena dato centro costo motivo excluye,"indico dato tabla exporto archivo , realizo ajuste procedimiento acumula finiquito incluir dato",68,4,296,258,207
2023-01-04 00:00:00,finiquitos,realizar descarga reporte aparece error,error orignado proceso ajuste tabla creditos,paso ajuste desarrollo,68,30,297,259,208
2023-01-04 00:00:00,costo total nomina,realizar descarga detalle gravado exento finiquitos marca error,ahcer revision funcionalidad no aplicada correctamente,hicieron ajustes proced descargue replica envio,68,35,298,260,209
2023-03-04 00:00:00,cheka-t,solicita realizar ajuste formato hora registros checada poder identificar empleados t urnos 12 horas corresponde entrada salida,"base datos formato hora correcto , requiere hacer ajuste ventana visualizacion formato 24 horas",realizo ajuste ventana sistema mostrar registros formato 24 horas,69,144,299,261,210
2023-03-04 00:00:00,reporte,solicitud agregar reporte pueda visualizar registros personal prueba,mostrar registros periodo mensual cumpla periodo 90 dias ingreso,agrego reporte visor reportes disenados descarga reporte,69,17,300,262,211
2023-03-04 00:00:00,actualizacion config,ajuste configuracion errores detectados poliza contable costo total acumulado,realizo validacion datos detectar finiquitos acumulados sin relacion centro costo .,actualizo historico datos correctosy pasaron procedimientos ajustados detalles detectados,69,145,301,263,212
2023-04-04 00:00:00,turnos,consulta saber realizar cambio nuevos turnos sistema,"comento no habia `` aplicado '' configuracion no recibio confirmacion , solicito correo cargar cambios sistema",aplico configuracion sistema recibir correo,70,146,302,264,213
2023-04-04 00:00:00,vales despensa,consulta funcionalidad pago vales despensa pagar cantidad distinta colaborador,reviso configuracion indico campo elque debe subir valor `` sumar '' valor extra importe calculado sistema,vacio,70,63,303,265,92
2023-04-04 00:00:00,prima dominical,solicitud configuracion agregar pago `` automatico '' prima dominical personal turno cy d,agrego configuracion concepto incluir pago personal turno definido,vacio,70,147,304,266,92
2023-04-04 00:00:00,calculo,realizar calculo nomina no aparecen empleados y/o conceptos pago reportes,reviso configuracion configuracion agregada turnos no `` aplico '' forma completa,aplico cambio visualizacion correcta,70,80,305,267,214
2023-04-04 00:00:00,comedor,detalle tarjetas no estan registrando,"reviso configuracon correcta sistema , indico asara nueva cuenta tarjeta pasaron 2 3 reportadas , valido informacin horario hik determinar detalle",solicito ajuste configuracion hik central no `` boten '' checadas no coindidir horarios,70,55,306,268,215
2023-04-04 00:00:00,cheka-t,"checadores hicieron cambio horario , ajustar registros .","solicito hora cambio servidor poder tomar parametro filtro ajuste registros , actualziar registros vez ajusto hora biometricos .",realizo update datos `` restar '' hora registro,70,144,307,269,216
2023-04-04 00:00:00,tiempo extra,subir archivo tiempo extra no distrubuye datos forma correcta,"empleados tiempo extra alto manda pago dobles , no separa triples",genero archivo ajuste envio usuario carga,70,33,308,270,217
2023-04-04 00:00:00,costo total nomina,intentar descargar archivo aparece ventana error,aparece error funcion datos cesantia vejez,"intentar crearla marco error pero no funcion existente , habia creado proced mismo nombre , elimino creo funcion forma correcta",70,35,309,271,218
2023-05-04 00:00:00,cheka-t,"revisar datos checadas dia hoy aparecen hora erronea , checador correcto",detalle originado checador manda correcto horario pero hik central `` mueve '' llegar bd dad llega incorrecto,solicito ajuste configuracion hik central pase dato correcto,71,144,310,272,219
2023-05-04 00:00:00,cheka-t,revisar datos checadas registros semana aparecen hora menos,detalle originado checador manda correcto horario pero hik central `` mueve '' llegar bd dad llega incorrecto,solicito ajuste configuracion hik central pase dato correcto,71,144,311,272,219
2023-05-04 00:00:00,baja empleado,realizar baja empleado ventana queda cargando,"reviso configuracion faltaba parametro insert tabla , usuario `` dos '' pudo realizar movimiento problema",agrego parametro faltante,71,148,312,273,220
2023-05-04 00:00:00,acumulado nomina,realizar descarga caratula periodo acumulado no coicide totales,reviso registros proceso dio alta nuevo concepto calculo nomina acumular incluyo imnporte,solicito `` eliminar '' concepto nuevo acumulacion cuadre nomina datos finales,71,149,313,274,221
2023-05-04 00:00:00,empleados,solicitud cambio registro patronal colaborador asignacion erronea,solicito cambio dato captura erronea,realizo ajuste manual,71,25,314,275,222
2023-10-04 00:00:00,recibos pago,"indico detalle saldo fondo ahorro , enviar recibo sem 14 aparece mismo saldo recibo enviado sem 13","valido informacion aparece correcta , detalle presento historicos , acumular nomina no `` completa '' debe cargar informacion faltante",solicito archivo costo total poder realizar carga informacion completa,72,72,315,276,223
2023-11-04 00:00:00,reingreso empleado,revision proceso reingreso empleado error realizar movimiento,aparecia error falta captura campos origen empleado,agrego validacion campos vacios mustren valor determinado almacene movimiento,73,150,316,277,224
2023-11-04 00:00:00,nomina especial,"apoyo generar nomina especial pago conceptos finiquito , vez cargados reportes no mostraban informacion",detalle proceso seleccion filtros informacion dentro ventana nomina especial,indico proceso seguir cada puntos poder realizar proceso correcto,73,62,317,278,225
2023-11-04 00:00:00,reporte conciliacion,recibio archivo diferencias validacion,"revision diferencias indicadas revision , ajustes cuentas contables no aparecen agrupacion datos",realizaron ajustes proceso generacion reporte poder mostrar registros no asignadas cuentas,73,151,318,279,226
2023-12-04 00:00:00,ausentismos,captura dias ausentismos dia festivo,intentar asignar dias ausentismo dia festivo no permite sistema,dentro sistema bloqueada captura incidencias dia festivo,74,152,319,280,227
2023-12-04 00:00:00,calculo nomina,quitar pago dias personal falto dia festivo,requiere quitar pago personal no permite captura ausentismo,agrego validacion formula excluir pago indica no laboro festivo segun horario corresponda,74,53,320,281,228
2023-12-04 00:00:00,ptu,solicitud poder descargar archivo reparto utilidades personal ambas plantas,funcionalidad base sistema exporta archivo cada razon social,"agrego ajuste poder exportar documento , pendiente funcionalidad dinamica",74,153,321,282,229
2023-12-04 00:00:00,periodo vacacional,configuracion quitar dias periodo vacacional personal no corresponde pago,solicitud apra habilitar periodo vacacional,agrego registro periodo correspondiente,74,154,322,283,230
13/04/2023,checadas,solicitud descarga checadas biometrico bromo,registros deben ser descargados attendance conexion no permite descarga sistema,vacio,75,31,124,47,92
13/04/2023,periodo vacacional,realizar calculo nomina no aparece descuento dias periodo vacacional,configuracion no aplico detalle procedimiento convertia mal dato quincena abierta,realizo ajuste validara correctamente dato,75,154,323,284,231
13/04/2023,costo total nomina,intentar realizar descarga reporte aparece ventana error,"reviso proceso , error iniciado columna importe cesantia vejez , salario empleado comparativa umas pasaba valor 99 tope inicial tabla",realizo ajuste expandir tope umas asi no `` bloque '' validacion pueda descargar correctamente,75,35,324,285,232
13/04/2023,nomina,realizar captura prestamo fondo ahorro no aparece calcular nomina,detecto concepto inactivo no aparece nomina,indico proceos seguir activar concepto aparezca descuento nomina,75,155,325,286,233
13/04/2023,timbrado nomina,consulta ajuste datos empleado timbrado nomina,"realizar timbrado nomina aparece detalle , no permite actualizar codigo postal 0 inicio","realizo prueba servidor almaceno dato correcto , realizar revision colaborador error timbrado encuentra nombre",75,69,326,287,234
13/04/2023,calculo ptu,realizar proceso exportar informacion solo muestran datos nomina,"capturar datos seleccion solo habia indicado registro concepto , deben seleccionar diferencian nomina",indico proceso usuario exportar archivo correctamente,75,156,327,288,235
13/04/2023,calculo ptu,realizar proceso exportar informacion solo muestran datos nomina aparecen empleados bajas ejercicio anterior reparto,"realizo prueba descarga datos aparecio correctamente , no incluye empleados","usuario `` resetear '' navegadores realizar descarga , seleccionaba datos correctos pero realizaba calculo `` distinto ''",75,156,328,289,236
13/04/2023,timbrado cfdi 4.0,"realizar proceso actualizacion indicaron datos obligatorios , usuario indico configuracion incompleta",usuario solicito `` regresar '' version anterior timbrado terminar proceso actualizacion datos,realizo ajuste configuracion version sistema,75,157,329,290,237
14/04/2023,reporte conciliacion,archivo diferencia datos periodos importados dad sistema anterior,revision historicos proceso generar mostrar importe concepto 55 anticipo nominas reporte,realizo revision carga datos periodos no generados directamente sistema agrego proceso mostrar importe faltande anticipo nominas,76,151,330,291,238
14/04/2023,nomina,realizar calculo nomina no aparece importe subsidio incapacidad empleado asigno periodo,revisar configuracion concepto solamente configurado aparecer indica valor campo complementario,"solicito correo electronico realizar cambio formula , mientras usuario realizara asignacion importe campo complementario",76,155,331,292,239
17/06/2023,timbrado nomina,intentar realizar timbrado aparece advertencia fecha hora incorrectos,servidor hora erronea,solicito area realizara ajuste hora,77,69,332,293,240
17/06/2023,reporte conciliacion,recibieron observaciones archivo revision,revision reporte archivo area contable,realizaron ajuste sen reporte poder incluir importe concepto 55,77,151,333,294,241
17/06/2023,bajas,solicitud eliminar baja empleado generada nomina acumulada,realizo movimiento manual sistema bloqueada opcion,"solicito ajuste sistema permitir usuario realizar movimiento , pasara desarrollo",77,158,334,295,242
17/06/2023,cancelacion xml,intentar realizar proceso cancelacion periodo erroneo pago aparece ventana advertencia,"realizo revision proceso , comento area desarrollo faltaba configuracion reqerida",programa actualizacion,77,122,335,296,243
17/06/2023,timbrado nomina,intentar realizar timbrado colaborador pago especial marca error datos rp,pago nomina especial realizo datos empleado mientras baja almacenados historico .,realizo ajuste dato historico pueda generar proceso sin problema,77,69,336,297,244
