fecha,modulo,detalle,comentario,solucion,fecha_id,modulo_id,detalle_id,comentario_id,solucion_id
14/04/2023,ptu,solicita revision calculo no aparecen empleados salen no deberian antiguedad,"empleado no sale , pertenece nomina asimilados no seleccionado conceptos nomina . empleados no deberian salir seleccion hizo calcular",mencionan conceptos configuracion seleccionamos prueba,76,153,836,756,705
15/04/2023,recibos,"menciona recibo empleado no sale correcto , pasa info hoja",vacio,modifica formato salga correctamente,198,302,837,92,706
17/04/2023,respaldo,solicita realice respaldo bd,vacio,realiza respaldo confirma,199,70,769,92,647
18/04/2023,recibos,menciona intenta descargar recibos qna202307 pero no aparece nomina,vacio,menciona necesario nomina acumulada pueda descargar apartado intenta,78,302,838,92,707
18/04/2023,calculos,menciona calculo ptu salen varios empleados salario mensual 3 meses 0,"revisa procedimiento , validacion fija fecha",realiza ajuste pide nuevamente calcular revisar,78,298,839,757,708
18/04/2023,empleados,solicita cambio fecha ingreso empleado equivocaron,vacio,realiza cambio bd,78,25,840,92,709
19/04/2023,calculos,solicita eliminen registros tiempo extra no autorizado,extraen datos poder hacer eliminacion,elimina informacion solicitada,79,298,841,758,710
19/04/2023,recibos,indica intentando descargar recibos dos qnas no descargan,intento descargarlos detectar error descarga,pide intentar nuevamente,79,302,842,759,711
19/04/2023,timbrado,indica problemas timbrar sistema compes,codigo postal no actualizado sistema compes,carga informacion pide intentar nuevamente,79,18,843,760,712
19/04/2023,empleados,solicitan cambio salario diario equivocaron,cambia internamente salario mensual diario integrado,realiza cambio solicitado bd,79,25,844,761,713
19/04/2023,empleados,solicita realice cambio clave empleado equivocaron,vacio,realiza cambio solicitado bd,79,25,845,92,713
19/04/2023,recibos,"menciona sale mal recibo empleado , salen conceptos varias veces",vacio,"revisa procedimiento pero salen bien datos , hace descarga nuevamente sale bien",79,302,846,92,714
20/04/2023,timbrado,"indica timbro registro compes sale salario diario integrado , debe salir 0","revisa procedimiento , validacion",realiza ajuste cobaed siempre salga 0,80,18,847,762,715
20/04/2023,empleados,solicita cambio rp dos empleados equivocaron dar alta,vacio,realiza cambio directo bd,80,25,848,92,716
21/04/2023,timbrado,menciona intenta timbrar empleado qna202305 sale timbrado,pregunta si podemos intentar timbrar pruebas timbro sin error,timbra envia reporte revision,81,18,849,763,717
22/04/2023,calculos,solicita realice activacion calculo ptu empleados,vacio,realiza activacion tomen consideracion calculo,82,298,850,92,718
22/04/2023,finiquitos,solicita cambie fecha baja empleado elaboracion finiquito,vacio,realiza cambio fechabaja directo bd,82,30,851,92,719
22/04/2023,respaldo,solicita realice respaldo bd,vacio,realiza respaldo confirma,82,70,769,92,647
24/04/2023,reportes,solicita ruta descargar reporte envie,"datos saco consulta pudiera revisar , no sistema .",creo consulta reporte disenados comparte ruta,83,32,852,764,720
24/04/2023,reportes,solicita reporte ver va timbrar qna202307,vacio,genera reporte consulta envia,83,32,853,92,721
24/04/2023,calculos,indica sale error calcular deducciones,"alcanza ver error imagen , item faltante procedimiento luego ultima actualizacion",agrega item pueda calcular pide intentar nuevamente,83,298,854,765,722
24/04/2023,calculos,indica sale error calcular nomina,detalle empleado capturo cantidad elevada deducciones incapacidad,"menciona intentan prorratear importe necesario eliminen primero capturen , no dejarle importe todas plazas",83,298,855,766,723
24/04/2023,reportes,menciona descargar reporte salen menos empleados reporte original,vacio,"menciona filtros consulta , realiza ajuste",83,32,856,92,724
25/04/2023,calculos,solicita realice activacion descuento fovissste empleados,realiza configuracion cada empleado deberia salir,realiza ajuste bd,200,298,857,767,725
25/04/2023,calculos,solicita realice activacion calculo ptu empleados excepto categoria `` practicante '',vacio,realiza activacion tomen consideracion calculo,200,298,858,92,718
25/04/2023,timbrado,solicita cambio fechas periodo especial,timbrado solo permite periodo especial mismas fechas periodo ordinario,realiza cambio solicitado bd,200,18,859,768,656
25/04/2023,calculos,menciona empleado no calculando correctamente disposicion judicial,"pasando proceso , calculo salio importe , volvio calcular guardo importe vacio",cargaron importes manualmente pudieran acumular saco respaldo revisar .,200,298,860,769,726
26/04/2023,timbrado,menciona salio error 13 empleados timbrar sistema compes,verifica sale error cp espacios nombre,comparte captura errores cada empleado pueda revisar corregir,84,18,861,770,727
27/04/2023,reportes,indica presenta error descargar reporte,detalle plazas modificaron guardaron horas decimales,corrigen horas plazas creadas agrega validacion procedimiento guardar,85,32,862,771,728
28/04/2023,timbrado,solicita timbres poder continuar timbrado,vacio,realiza asignacion folios,86,18,863,92,729
28/04/2023,timbrado,"indica error 3 empleados timbrar , incapacidades",anteriormente presentado detalle pero timbrado nominas anteriores,"realiza ajuste procedimiento timbrado nomina abierta , conflicto validacion fechas",86,18,864,772,730
28/04/2023,respaldo,solicita realice respaldo bd,vacio,realiza respaldo confirma,86,70,769,92,647
2023-02-05 00:00:00,empleados,solicita cambio clave empleado equivocaron darlo alta cambio sueldo diario dos empleados,vacio,realiza cambio solicitado,88,25,865,92,639
2023-02-05 00:00:00,timbrado,solicita asignacion folios dos empresas,revisa empresas falta asignar vez,realiza asignacion,88,18,866,773,645
2023-02-05 00:00:00,timbrado,menciona sale mensaje timbrar empleados qna 202306 timbrado,confirma no sido timbrados pide volver intentar,"envia reporte error no deja timbrar , espacios nombre cp incorrecto",88,18,867,774,731
2023-02-05 00:00:00,recibos,"menciona sale mal recibo empleado , salen conceptos varias veces",vacio,realiza modificacion procedimiento envia recibos nomina abierta,88,302,846,92,732
2023-02-05 00:00:00,timbrado,"menciona error timbrar empleado qna 202306 , sale importe negativo",revisa detalle tomaba datos tablas plazas pero compe no datos,realiza modificacion tome empleados,88,18,868,775,733
2023-03-05 00:00:00,empleados,solicita cambio sueldo diario dos empleados,vacio,realiza cambio solicitado,89,25,869,92,639
2023-03-05 00:00:00,timbrado,solicita cambio fechas periodo especial,timbrado solo permite periodo especial mismas fechas periodo ordinario,realiza cambio solicitado bd,89,18,859,768,656
2023-03-05 00:00:00,timbrado,"indica timbro dos empleados periodicidad mal , no debe ser 99",vacio,menciona forma haciendo nomina configuracion correcto 99,89,18,870,92,734
2023-03-05 00:00:00,acumulado,"menciona error acumular nomina , tiempo no terminaba",vacio,"realiza llamada luego enviar correo brindo indicaciones , termino acumular nomina",89,305,871,92,735
2023-03-05 00:00:00,respaldo,solicita realice respaldo bd,vacio,realiza respaldo confirma,89,70,769,92,647
2023-04-05 00:00:00,empleados,"solicita carga informacion empleados datos numero cuenta , tipo pago desactivar pago directo",vacio,realiza carga informacion,90,25,872,92,736
2023-06-05 00:00:00,timbrado,"indica error timbrar registro qna 06 , folio","validacion siempre pusiera folio 13 , modifico genere folio datos periodo fecha genera",realizo modificacion proced genere folio automatico,201,18,873,776,737
2023-08-05 00:00:00,reportes,indica descargar reporte 138 timbrado solo sale nomina ordinaria compe,"reporte creado solo sistema normal , indica quiere descargar compe , pide indique cual reporte intentando revisar","menciona reporte creado unicamente sistema normal , no compe",93,32,874,777,738
2023-08-05 00:00:00,creditos,menciona error cambiar tipo descuento credito,faltaba crear tabla generado hace desarrollo,crea tabla necesaria,93,301,875,778,739
2023-09-05 00:00:00,calculos,solicita acomodo centavos,realiza actualizacion tabla pension alimenticia,realiza ajuste solicitado,94,298,876,779,740
2023-09-05 00:00:00,empleados,solicita realice cambio clave empleado equivocaron,vacio,realiza cambio solicitado bd,94,25,845,92,713
2023-09-05 00:00:00,timbrado,menciona sacar reporte timbrado salen 111 timbrados deberian ser 117,"revisa 6 no timbrado , pide revisar boton ver muestra no sido timbrados",pide revisar intentar timbrar,94,18,877,780,741
2023-10-05 00:00:00,reportes,menciona cfdi 's acaba descargar no salen onedrive,"tarda sincronizar cuenta , cargan archivos cuenta nancy",cargan recibos onedrive nancy,95,32,878,781,742
2023-10-05 00:00:00,empleados,solicita carga informacion empleados baja sistema,prepara archivo poder realizar carga masiva,carga informacion,95,25,879,782,743
2023-11-05 00:00:00,reportes,solicita reporte saber va timbrar qna202308,vacio,genera reporte consulta envia,96,32,880,92,721
2023-11-05 00:00:00,empleados,indica error modificar fecha ingreso empleado,"pide indique error sale menu intentando cambiarla , informacion empleado no permite , menu",indica menu indicado poder realizar cambio,96,25,881,783,744
2023-12-05 00:00:00,empleados,"menciona empleado sale riesgo puesto 1 , deberia ser 99 , solicitado validacion siempre apareciera 99",menciona validacion pero empleados guardado 1 hacerla,realiza modificacion 99 faltantes,97,25,882,784,745
2023-12-05 00:00:00,timbrado,"indica error timbrar registro qna 06 , folio",cambio realizado procediemiento pero validacion campo mayor 0 entrara pero campo null no entraba,realizo modificacion validacion,97,18,873,785,746
15/05/2023,respaldo,solicita realice respaldo bd,vacio,realiza respaldo confirma,98,70,769,92,647
15/05/2023,calculos,solicita carguen importes ptu,"envia importes separado gravado / exento carga , prepara archivo",realiza carga importes masivamente,98,298,883,786,747
16/05/2023,timbrado,solicita asignacion folios,asignan 2500,asignan confirma,99,18,812,787,684
16/05/2023,timbrado,indica error timbrar empleado,detalle prorrateo importes plaza,realiza ajustes centavos permita timbrarlo,99,18,884,788,748
16/05/2023,calculos,solicita ruta realizar cambios tabuladores porcentaje prima ant .,vacio,proporciona ruta realiza ajuste formula empleado quede fijo porcentaje asi solicito pao,99,298,885,92,749
17/05/2023,empleados,solicita cambio clave empleado,vacio,realiza cambio solicitado,202,25,886,92,639
17/05/2023,timbrado,solicita ponga filtro timbrado periodo retroactivo,vacio,modifica procedimiento poner filtro,202,18,887,92,750
17/05/2023,recibos,menciona sale error pantalla descarga recibos nomina,vacio,"servidor saturado , reinicio iis",202,302,888,92,751
17/05/2023,timbrado,indica descargar recibos empleado sale timbrado concepto retroactivo,"revisa timbrado fechas 13 13 enero retroactivo , entonces queda pendiente timbrar periodo 2da parte aguinaldo",realiza modificacion fechas inicio fin periodos salgan recibos correctamente timbre aguinaldo,202,18,889,789,752
17/05/2023,calculos,solicita ciertos conceptos puedan activar / desactivar plantel,vacio,crean campos complementarios cada concepto modifican formulas,202,298,890,92,753
18/05/2023,portal empleados,error visualizar recibos nomina portal empleados,vacio,revisa procedimiento faltaba campo fechaant opciones,203,258,891,92,754
18/05/2023,calculos,solicita modifiquen conceptos no salga retroactivo,vacio,regresan formulas no salga importe demas,203,298,892,92,755
18/05/2023,finiquitos,solicita eliminacion finiquito,vacio,eliminan datos finiquito acumulado,203,30,893,92,756
18/05/2023,checadas,solicita carga checadas bromo,descargan computadora cargan bd,realiza carga,203,31,894,790,757
18/05/2023,checadas,solicita carga checadas,descargan computadora cargan bd,realiza carga,203,31,895,790,757
19/05/2023,timbrado,solicita ponga filtro bloques timbrar periodo 2da parte aguinaldo,vacio,modifica procedimiento poner filtro,204,18,896,92,750
19/05/2023,ptu,solicita listado empleados reingreso validarlo calculo ptu,vacio,genera reporte mediante consulta envia,204,153,897,92,758
19/05/2023,finiquitos,menciona empleado sale desgloce creditos reporte finiquito,vacio,revisa menciona no salgan debe desactivar misma ventana deducciones boton prestamos,204,30,898,92,759
19/05/2023,ptu,indica empleados salen menos dias considerando fecha reingreso no ingreso,menciona detalle momento realizar reingreso sale ventana pregunta si desea respete dieron no,da opcion ingresar fecha debe tomar campo fecha antiguedad empleados agregar validacion salga correctamente,204,153,899,791,760
19/05/2023,recibos,menciona no puede descargar recibos nomina 202308,entre servidor descargue,cargue cuenta onedrive,204,302,900,792,761
19/05/2023,timbrado,solicita cambio fecha ingreso empleado periodo 202309 efectos timbrado reporte va timbrar,vacio,realiza cambio comparte reporte,204,18,901,92,762
19/05/2023,timbrado,solicita asignen folios empresa poder timbrar,vacio,realiza asignacion,204,18,767,92,645
19/05/2023,calculos,indica empleado no saliendo pago prima vacacional,concepto validacion fecha aniversario debe fechas inicio fin nomina abierta,"menciona validacion ademas campo activar , pone 1 pide volver calcular",204,298,902,793,763
19/05/2023,calculos,solicita elimine calculo especial poder acumular nomina ordinaria,vacio,eliminan datos calculo especial solicitado,204,298,903,92,764
19/05/2023,calculos,indica saliendo alto importe isr,modificado formulas nomina especial estimulo antiguedad,regresan formulas no salga importe demas,204,298,904,794,755
20/05/2023,calculos,menciona nomina sale alto isr,anteriormente realizado ajuste nomina especial,regresan items procedimiento salga calculo correcto,205,298,905,795,765
20/05/2023,timbrado,indica error timbrar empleado,cp empleado no igual sat,realiza cambio empleado baja,205,18,906,796,766
22/5/2023,reportes,menciona descargando reporte timbrados reporte 138 no coincide cantidad registros,"revisa mal consulta reporte timbrados , no saliendo registros",realiza ajuste salga correcto,206,32,907,797,767
22/5/2023,respaldo,solicita realice respaldo bd,vacio,realiza respaldo confirma,206,70,769,92,647
22/5/2023,recibos,indica error descargar cfdi 's,error genera no queda espacio servidor realizando descarga nube ocupa espacio,"recomienda generar descarga equipo forma local , esto no suceda",206,302,908,798,768
23/5/2023,empleados,solicita cambio clave empleado,vacio,realiza cambio solicitado,207,25,886,92,639
23/5/2023,calculos,envia 2 casos empleados no sale fovissste,valida bd,realiza ajuste salga,207,298,909,799,769
23/5/2023,calculos,menciona no sale ahorro solidario empleado,vacio,"valida bd , condiciones activarlo",207,298,910,92,770
24/05/2023,timbrado,solicita cambio fechas periodo especial,timbrado solo permite periodo especial mismas fechas periodo ordinario,realiza cambio solicitado bd,102,18,859,768,656
24/05/2023,recibos,solicita cambio nombre recibos pago firma jefe recursos humanos,modifican formatos cambiando nombre envian,realiza cambio solicitado,102,302,911,800,639
25/05/2023,usuarios,solicita nuevo usuario sistema jefe,vacio,genera usuario contrasena comparte,103,42,912,92,771
25/05/2023,empleados,envia listado activar empleados nomina especial realizar cambio forma pago,vacio,activan empleados nomina especial realiza cambio forma pago,103,25,913,92,772
25/05/2023,retroactivos,indica capturo mal elimino dos retroactivos empleado intento capturarlos nuevo pero empleado no sale listado,consulta validacion no muestre capturado retro,quito validacion pudiera capturar nuevo,103,300,914,801,773
26/05/2023,ptu,menciona dudas sale diferente cantidad ptu determinando ptu final realizar calculo,vacio,"correcto , comparte guia pueda entender motivo",104,153,915,92,774
26/05/2023,respaldo,solicita realice respaldo bd,vacio,realiza respaldo confirma,104,70,769,92,647
26/05/2023,reportes,indica error intentar insertar permisos usuario reportes,darle dos clics mismo tiempo inserta dos registros tabla permisos,deja solo registro no marque error,104,32,916,802,775
27/05/2023,reportes,menciona revisando reporte envie timbrado qna202309 pero no cuadran totales,"saca nuevamente listado empleado no , motivo pago cancelado",indica razon menciona falta total cuadren .,105,32,917,803,776
27/05/2023,empleados,solicita cambio cp empleado baja poder timbrar finiquito,vacio,realiza cambio bd,105,25,918,92,709
27/05/2023,empleados,solicita mismo listado enviado elimine calculos nomina especial menos empresa vsa,realiza bd,regresa valor no aparezcan especial,105,25,919,804,777
2023-05-29 00:00:00,timbrado,solicita timbres poder continuar timbrado,vacio,realiza asignacion folios,208,18,863,92,729
2023-05-29 00:00:00,timbrado,solicita cambios fechas ingreso efectos timbrado nomina 202309,vacio,realiza cambio directo bd periodo solicitado,208,18,920,92,778
2023-05-29 00:00:00,reportes,pregunta si sistema existe reporte consultar historial cambios salario trabajadores,vacio,"brinda reporte trae datos indica , pide revisarlo saber si necesita",208,32,921,92,779
2023-05-30 00:00:00,timbrado,indica error intentar timbrar,pide intentar nuevamente compartan algun empleado realizar pruebas .,"comparten empleado sale error diferente pero cp no coincide sat , deben cambiarlo .",209,18,922,805,780
2023-05-30 00:00:00,timbrado,solicita cambio fechas periodo especial,timbrado solo permite periodo especial mismas fechas periodo ordinario,realiza cambio solicitado bd,209,18,859,768,656
2023-05-30 00:00:00,timbrado,solicita si podemos intentar timbrar empleado,vacio,timbro intento confirma .,209,18,923,92,781
2023-05-30 00:00:00,empleados,solicita cambio cp empleado baja,vacio,realiza cambio solicitado bd,209,25,924,92,656
2023-05-30 00:00:00,empleados,solicita cambio cp 3 empleados baja,vacio,realiza cambio solicitado bd,209,25,925,92,656
2023-05-31 00:00:00,timbrado,indica error timbrar,vacio,"menciona datos solicita version 4.0 , debe validar cp",210,18,926,92,782
2023-05-31 00:00:00,empleados,envia listado cp actualizacion masiva,vacio,realiza cambio solicitado bd,210,25,927,92,656
2023-05-31 00:00:00,empleados,solicita cambio cp 4 empleados baja,vacio,realiza cambio solicitado bd,210,25,928,92,656
2023-06-01 00:00:00,empleados,solicita cambio cp 17 empleados baja,vacio,realiza cambio solicitado bd,5,25,929,92,656
2023-06-01 00:00:00,timbrado,indica errores timbrar,vacio,"preguntamos fh error , debido sat problemas",5,18,930,92,783
2023-06-01 00:00:00,checadas,solicita carga checadas bromo,descargan computadora cargan bd,realiza carga,5,31,894,790,757
2023-06-02 00:00:00,empleados,solicita cambio cp 2 empleados baja,vacio,realiza cambio solicitado bd,211,25,931,92,656
2023-06-02 00:00:00,calculos,solicita listado empleados dias trabajados faltas enero mayo revisar pago prestaciones,vacio,medio consulta bd genera listado envia,211,298,932,92,784
2023-06-02 00:00:00,empleados,solicita cambio cp empleado baja,vacio,realiza cambio solicitado bd,211,25,924,92,656
2023-06-02 00:00:00,reportes,solicita reporte especifique tipo sindicato cada empleado,vacio,genera reportes disenados indica ruta descarga,211,32,933,92,785
2023-06-05 00:00:00,empleados,solicita cambio cp 2 empleados baja,vacio,realiza cambio solicitado bd,201,25,931,92,656
2023-06-05 00:00:00,timbrado,solicita cambios fechas ingreso efectos timbrado nomina 202310,vacio,realiza cambio directo bd periodo solicitado,201,18,934,92,778
2023-06-05 00:00:00,reportes,solicita reporte como va timbrar qna202310 ord,vacio,genera reporte medio consulta envia,201,32,935,92,786
2023-06-05 00:00:00,reportes,indica descargar repote 44 no muestra nada informacion,vacio,"revisa consulta , periodo especial almaceno hora , ello conflicto",201,32,936,92,787
2023-06-06 00:00:00,reportes,solicita reporte como va timbrar qna202309 estimulos,vacio,genera reporte medio consulta envia,113,32,937,92,786
2023-06-06 00:00:00,empleados,solicita cambio cp 2 empleados baja,vacio,realiza cambio solicitado bd,113,25,931,92,656
2023-06-06 00:00:00,recibos,indica realizo descarga recibos no aparecen cuenta onedrive,vacio,entre servidor sincronizar cuenta,113,302,938,92,788
2023-06-06 00:00:00,actualizacion,realiza actualizacion sistema dadrh compes,vacio,agrego opcion descargar recibos nomina forma local,113,23,939,92,789
2023-06-06 00:00:00,calculos,solicita 3 empleados no salga subsidio qna202309 estimulos,vacio,pone campo nosubsidio=1 desactivar,113,298,940,92,790
2023-06-07 00:00:00,timbrado,envia errores timbrar empleados,empleados enviado desactivarles subsidio .,"dato tomando consulta tabla empleados , pero debia ser historicos , realiza cambio",135,18,941,806,791
2023-06-07 00:00:00,calculos,solicita acomodo centavos qna202311,realiza actualizacion tabla pension alimenticia,realiza ajuste solicitado,135,298,942,779,740
2023-06-07 00:00:00,empleados,solicita cambio cp 2 empleados baja,vacio,realiza cambio solicitado bd,135,25,931,92,656
2023-06-08 00:00:00,contratos,solicita revision formatos contratos ocasiones corta texto,vacio,modifican formatos error debido nombre empleado largo,212,21,943,92,792
2023-10-06 00:00:00,calculos,menciona calculo no sale concepto ajuste salarial,vacio,"motivo formula concepto no consideraba sueldo docente , ello docentes no salia concepto",213,298,944,92,793
2023-12-06 00:00:00,timbrado,pide ponga periodo 202310 filtro poder timbrarlo,cambia periodo procedimiento timbrar,realiza movimiento solicitado,117,18,945,736,678
2023-12-06 00:00:00,empleados,solicita cambio cp empleado baja,vacio,realiza cambio solicitado bd,117,25,924,92,656
2023-12-06 00:00:00,empleados,solicita cambio cp empleado baja,vacio,realiza cambio solicitado bd,117,25,924,92,656
13/06/2023,empleados,solicita cambio cp empleado baja,vacio,realiza cambio solicitado bd,214,25,924,92,656
13/06/2023,calculos,"cerro primera nomina junio , solicita nuevo listado empleados dias trabajados faltas enero mayo revisar pago prestaciones",vacio,medio consulta bd genera listado envia,214,298,946,92,784
13/06/2023,reportes,solicita oculte periodo 202310 portal recibos,modifica procedimiento poder ocultar periodo,realizan ajustes confirma,214,32,947,807,655
14/06/2023,calculos,pregunta si campos captura dias faltas prestaciones inicializados,vacio,revisan campos correspondientes confirma comiencen captura,118,298,948,92,794
14/06/2023,formatos,indica formato sivale salen movidos campos,revisa procedimiento,ordenan campos formato salgan correctos,118,306,949,808,795
15/06/2023,calculos,solicita acomodo centavos qna202312 2 veces volvieron calcular,realiza actualizacion tabla pension alimenticia,realiza ajuste solicitado,119,298,950,779,740
15/06/2023,checadas,solicita carga checadas,descargan computadora cargan bd,realiza carga,119,31,895,790,757
16/06/2023,empleados,solicita cambio cp empleado baja,vacio,realiza cambio solicitado bd,120,25,924,92,656
16/06/2023,contratos,envia formatos subir sistema,vacio,generan formatos contratos puedan generar datos empleados sistema,120,21,951,92,796
16/06/2023,calculos,menciona error calcular nomina especial,marcaba error item procedimiento,"comentado , tomaba si no existiera , hace calculo confirmar no marcara error",120,298,952,809,797
16/06/2023,calculos,indica sale diferencia empleados concepto ajuste salarial,vacio,revisa empleados toca menos dias conforme plazas asignadas cada empleado,120,298,953,92,798
19/06/2023,timbrado,indica error timbrar empleado qna202309,"detalle empleado periodo capturada fecha 2017 , fecha real 2015",solicita cual fecha debe considerar ajustarla pueda timbrarlo,121,18,954,810,799
19/06/2023,calculos,"solicita regrese formula concepto puntualidad anteriormente , salen dias extras",vacio,realiza cambio formula solo pague 6 dias,121,298,955,92,800
19/06/2023,empleados,solicita empleado modifique falta segundo nombre,vacio,modifica nombre directo bd,121,25,956,92,801
19/06/2023,timbrado,solicita asignen folios empresa poder timbrar,vacio,realiza asignacion,121,18,767,92,645
19/06/2023,empleados,solicita cambio clave empleado,vacio,modifica clave directo bd,121,25,886,92,802
19/06/2023,empleados,solicita empleado cambie registro patronal dio alta erroneo,vacio,modifica rp directo bd,121,25,957,92,803
20/6/2023,checadas,solicita carga checadas,descargan computadora cargan bd,realiza carga,215,31,895,790,757
20/6/2023,calculos,solicita acomodo centavos pension alimenticia nomina especial 202312,vacio,realiza ajuste bd,215,298,958,92,804
20/6/2023,timbrado,solicita cambios fechas ingreso efectos timbrado nomina 202311,vacio,realiza cambio periodo,215,18,959,92,805
20/6/2023,timbrado,indica entrar sistema compes querer timbrar registro no aparece ningun empleado,"hace procedimientos cambio cobaed entrara cierta opcion , necesario realizar ajuste procedimiento",realizo ajuste pudieran aparecer datos,215,18,960,811,806
20/6/2023,timbrado,solicita cambio fechas dos periodos especial,timbrado solo permite periodo especial mismas fechas periodo ordinario,realiza cambio solicitado bd,215,18,961,768,656
20/6/2023,calculos,indica sale diferencia empleados concepto ajuste salarial,"verifican datos , capturaron dias considerar plaza",realizo ajuste capturaran dias tomara empleado no plaza,215,298,953,812,807
21/6/2023,calculos,solicita listado empleados dias trabajados faltas abril junio revisar pago prima vacacional,vacio,medio consulta bd genera listado envia,216,298,962,92,784
21/6/2023,contratos,envia listado personal realizar asignacion contratos,vacio,realiza asignacion contrato correspondiente cada empleado,216,21,963,92,808
21/6/2023,empleados,solicita cambio cp empleado baja,vacio,realiza cambio solicitado bd,216,25,924,92,656
